{
 "schema": "bird.bend.bringup_steps",
 "schema_version": 1,
 "guide": {
  "title": "Bird Bend Stand — board bring-up guide",
  "version": "FW 0.8.6 / guide 0.4",
  "file": "BRINGUP_GUIDE.md",
  "content_version": "B test fixture (former 28-step example; engine tests, not shipped)"
 },
 "send_to": "Send this zip file to the product owner (e-mail) together with the photos of section 13.",
 "sections": [
  {
   "id": "6",
   "title": "6 PC software and first connection"
  },
  {
   "id": "7",
   "title": "7 Input checks — 48 V still OFF"
  },
  {
   "id": "8",
   "title": "8 48 V on: driver power, ENABLE / DISABLE, D-42 ENA cut"
  },
  {
   "id": "9",
   "title": "9 First motion — slow, no specimen"
  },
  {
   "id": "10",
   "title": "10 Direct-drive qualification (SYS-011)"
  },
  {
   "id": "11",
   "title": "11 Calibration (travel, load, tare)"
  },
  {
   "id": "12",
   "title": "12 Save to NVM, restart, verify"
  },
  {
   "id": "13",
   "title": "13 Bring-up package"
  }
 ],
 "steps": [
  {
   "id": "6.3",
   "section": "6",
   "title": "Device line",
   "instruction": "Connection & Config tab: read the Device line.",
   "expected": "FW 0.8.6 (build 20261010-2135), dict hash 0xF8BCDCB8 ✓",
   "kind": "auto",
   "stop_if_fail": true,
   "hg": "≈ HG gate S-00 identity check",
   "action": "show:connection",
   "auto": {
    "stages": [
     {
      "text": "waiting for the board identity (GET_INFO) …",
      "all": [
       {
        "src": "info",
        "key": "fw_version",
        "op": "eq",
        "value": "0.8.6",
        "label": "FW"
       },
       {
        "src": "info",
        "key": "build",
        "op": "eq",
        "value": "20261010-2135",
        "label": "build"
       },
       {
        "src": "info",
        "key": "param_dict_hash",
        "op": "eq",
        "value": {
         "$const": "PARAM_DICT_HASH"
        },
        "label": "dict hash"
       },
       {
        "src": "info",
        "key": "uid",
        "op": "present",
        "label": "UID"
       }
      ]
     }
    ]
   }
  },
  {
   "id": "6.5",
   "section": "6",
   "title": "Link at 80 Hz",
   "instruction": "Link line: about 80 Hz samples, no losses growing; LINK chip green CONNECTED.",
   "expected": "LINK CONNECTED, 76…84 SPS",
   "kind": "auto",
   "auto": {
    "stages": [
     {
      "text": "waiting for the stream …",
      "all": [
       {
        "src": "link",
        "key": "state",
        "op": "eq",
        "value": "CONNECTED",
        "label": "link"
       },
       {
        "src": "stream",
        "key": "rate_sps",
        "op": "between",
        "value": [
         76,
         84
        ],
        "label": "rate [SPS]"
       }
      ]
     }
    ],
    "timeout_s": 30
   }
  },
  {
   "id": "6.7",
   "section": "6",
   "title": "Board configuration",
   "instruction": "Board configuration table (tick show advanced): check the listed values.",
   "expected": "drv.pwr_sense_enable 0, drv.k1_check_enable 0, motion.steps_per_mm 800, afe.rate_sps 80 SPS",
   "kind": "auto",
   "stop_if_fail": true,
   "hg": "≈ HG-32 / C-26",
   "auto": {
    "stages": [
     {
      "all": [
       {
        "src": "param",
        "key": "drv.pwr_sense_enable",
        "op": "eq",
        "value": 0
       },
       {
        "src": "param",
        "key": "drv.k1_check_enable",
        "op": "eq",
        "value": 0
       },
       {
        "src": "param",
        "key": "motion.steps_per_mm",
        "op": "eq",
        "value": 800
       }
      ]
     }
    ]
   }
  },
  {
   "id": "6.8",
   "section": "6",
   "title": "Indicator chips, 48 V off",
   "instruction": "Compare the indicator bar with the table of the guide (48 V OFF, E-stop released, switches closed).",
   "expected": "no latch, LIM S / LIM E green, HOMED red, ENA red, ALM red, CLK green",
   "kind": "auto",
   "auto": {
    "stages": [
     {
      "all": [
       {
        "src": "ind",
        "key": "estop",
        "op": "off"
       },
       {
        "src": "ind",
        "key": "halt",
        "op": "off"
       },
       {
        "src": "ind",
        "key": "paused",
        "op": "off"
       },
       {
        "src": "ind",
        "key": "fault",
        "op": "off"
       },
       {
        "src": "ind",
        "key": "limit_start",
        "op": "off"
       },
       {
        "src": "ind",
        "key": "limit_end",
        "op": "off"
       },
       {
        "src": "ind",
        "key": "homed",
        "op": "off"
       },
       {
        "src": "ind",
        "key": "clk_fallback",
        "op": "off"
       }
      ]
     }
    ]
   }
  },
  {
   "id": "6.9",
   "section": "6",
   "title": "Load cell sign",
   "instruction": "Readouts dock → Raw: pull lightly on the load cell by hand (tension), then push.",
   "expected": "Raw increases on pull (a reversed sign is allowed — write it down)",
   "kind": "measure",
   "fields": [
    {
     "name": "sign",
     "label": "Raw on pull",
     "kind": "choice",
     "choices": [
      "increases",
      "decreases"
     ]
    },
    {
     "name": "raw_pull",
     "label": "Raw while pulling",
     "kind": "number",
     "unit": "counts",
     "decimals": 0,
     "required": false,
     "required_when": {
      "field": "sign",
      "op": "eq",
      "value": "decreases"
     }
    }
   ]
  },
  {
   "id": "7.1",
   "section": "7",
   "title": "E-stop latch",
   "instruction": "Press the red E-stop and keep it pressed for more than 1 s.",
   "expected": "ESTOP red, only ESTOP latched — no K1_WELDED, no other fault",
   "kind": "auto",
   "stop_if_fail": true,
   "hg": "≈ HG-32",
   "auto": {
    "stages": [
     {
      "text": "waiting for ESTOP …",
      "all": [
       {
        "src": "event",
        "key": "ESTOP_SET",
        "op": "seen"
       },
       {
        "src": "ind",
        "key": "estop",
        "op": "on"
       }
      ]
     }
    ],
    "fail_if": [
     {
      "src": "event",
      "key": "FAULT_SET",
      "op": "seen",
      "label": "fault latched"
     }
    ]
   }
  },
  {
   "id": "7.2",
   "section": "7",
   "title": "E-stop clear",
   "instruction": "Release the button (ESTOP stays red), wait ≥ 100 ms → Clear stop… → Clear E-STOP.",
   "expected": "ESTOP green; nothing moves",
   "kind": "auto",
   "action": "clear_stop",
   "auto": {
    "stages": [
     {
      "text": "waiting for Clear E-STOP …",
      "all": [
       {
        "src": "event",
        "key": "ESTOP_CLEARED",
        "op": "seen"
       },
       {
        "src": "ind",
        "key": "estop",
        "op": "off"
       }
      ]
     }
    ],
    "fail_if": [
     {
      "src": "data_flag",
      "key": "MOVING",
      "op": "set",
      "label": "axis moving"
     }
    ]
   }
  },
  {
   "id": "7.3",
   "section": "7",
   "title": "PAUSE button",
   "instruction": "Press and release PAUSE once; then clear with ▶ Resume.",
   "expected": "PAUSED amber (BUTTON), then green after Resume",
   "kind": "auto",
   "auto": {
    "stages": [
     {
      "text": "press PAUSE …",
      "all": [
       {
        "src": "data_status",
        "key": "PAUSED",
        "op": "set"
       }
      ]
     },
     {
      "text": "now ▶ Resume …",
      "all": [
       {
        "src": "data_status",
        "key": "PAUSED",
        "op": "clear"
       }
      ]
     }
    ]
   }
  },
  {
   "id": "7.4",
   "section": "7",
   "title": "START switch",
   "instruction": "Press the START switch lever by hand, then release it.",
   "expected": "LIM S red LIMIT_START, green again after release",
   "kind": "auto",
   "auto": {
    "stages": [
     {
      "text": "press the START lever …",
      "all": [
       {
        "src": "data_status",
        "key": "LIMIT_START",
        "op": "set"
       }
      ]
     },
     {
      "text": "release it …",
      "all": [
       {
        "src": "data_status",
        "key": "LIMIT_START",
        "op": "clear"
       }
      ]
     }
    ]
   }
  },
  {
   "id": "7.7",
   "section": "7",
   "title": "Both limit connectors unplugged",
   "instruction": "Unplug both limit connectors at once, plug both back → Clear stop… → Clear faults.",
   "expected": "LIMIT_WIRING + FAULT, all green after Clear faults",
   "kind": "auto",
   "action": "clear_stop",
   "hg": "≈ HG-17",
   "auto": {
    "stages": [
     {
      "text": "unplug both connectors …",
      "all": [
       {
        "src": "fault",
        "key": "LIMIT_WIRING",
        "op": "set"
       }
      ]
     },
     {
      "text": "plug back, Clear faults …",
      "all": [
       {
        "src": "fault",
        "key": "LIMIT_WIRING",
        "op": "clear"
       },
       {
        "src": "ind",
        "key": "fault",
        "op": "off"
       }
      ]
     }
    ]
   }
  },
  {
   "id": "8.3",
   "section": "8",
   "title": "ALM off with 48 V on",
   "instruction": "Observer switches the 48 V PSU on; watch ALM and PEND.",
   "expected": "ALM green OFF within ≈ 1 s",
   "kind": "auto",
   "stop_if_fail": true,
   "hg": "≈ HG-16",
   "auto": {
    "stages": [
     {
      "text": "waiting for ALM off …",
      "all": [
       {
        "src": "io",
        "key": "ALM",
        "op": "clear"
       }
      ],
      "min_s": 1.0
     }
    ],
    "timeout_s": 120
   }
  },
  {
   "id": "8.5",
   "section": "8",
   "title": "ENABLE",
   "instruction": "Hands off the shaft → Manual tab → tick Driver enabled.",
   "expected": "ENA amber ENABLING, then green enabled; the motor holds",
   "kind": "motion",
   "motion": false,
   "action": "enable",
   "hg": "≈ HG-07",
   "auto": {
    "stages": [
     {
      "text": "waiting for ENABLED …",
      "all": [
       {
        "src": "data_flag",
        "key": "ENABLED",
        "op": "set"
       }
      ]
     }
    ]
   }
  },
  {
   "id": "8.6",
   "section": "8",
   "title": "DISABLE = free",
   "instruction": "Untick Driver enabled (dialog: Specimen is unloaded → Disable); turn the coupling by hand.",